{
  "version": 1,
  "run_id": "0192f0c1-7d4e-7a2b-8c3d-4e5f6a7b8c9d",
  "wall": true,
  "labels": {
    "forge": "example-forge",
    "repository": "example-namespace/project"
  },
  "about": {
    "title": "Fix the failing build"
  },
  "images": {
    "default": "base",
    "definitions": [
      {
        "name": "base",
        "ref": "registry.example/agents/base@sha256:4f4f4f4f4f4f4f4f4f4f4f4f4f4f4f4f4f4f4f4f4f4f4f4f4f4f4f4f4f4f4f4f",
        "runtime": "sysbox-runc"
      },
      {
        "name": "with-docker",
        "ref": "registry.example/agents/with-docker@sha256:a1a1a1a1a1a1a1a1a1a1a1a1a1a1a1a1a1a1a1a1a1a1a1a1a1a1a1a1a1a1a1a1",
        "runtime": "sysbox-runc",
        "docker": true
      }
    ]
  }
}
