{
  "version": 1,
  "run_id": "0192f0c1-7d4e-7a2b-8c3d-4e5f6a7b8c9d",
  "wall": true,
  "labels": {
    "forge": "example-forge",
    "repository": "example-namespace/project",
    "run_key": "rk-0001"
  },
  "about": {
    "title": "Fix the failing build",
    "details": {
      "requester": "requester"
    }
  },
  "images": {
    "default": "base",
    "definitions": [
      {
        "name": "base",
        "ref": "registry.example/agents/base@sha256:4f4f4f4f4f4f4f4f4f4f4f4f4f4f4f4f4f4f4f4f4f4f4f4f4f4f4f4f4f4f4f4f",
        "runtime": "sysbox-runc"
      }
    ]
  },
  "narrowing": {
    "egress": {
      "allow": [
        "api.example",
        "git.example"
      ],
      "deny": [
        "tracker.example"
      ]
    }
  }
}
